{
  "schema_version": "4.0",
  "case_id": "case001-v2",
  "contract_id": "case001-v2.contract-v1",
  "version": 1,
  "source_id": "src-authored-order-csv",
  "source_version": "1",
  "source_sha256": "089f741805a2230096d8ee2e01154ee381e02f6f7060078a698c642d43760e2a",
  "rules": [
    {
      "rule_id": "R01",
      "source_text": "- R01 输入：只读取一个 UTF-8 编码、有表头、逗号分隔的 orders.csv。列名和顺序必须恰为 order_id,customer_id,updated_at,amount。order_id 和 customer_id 始终按大小写敏感字符串处理，保留前导零；输入记录按 CSV 数据记录顺序编号，从 1 开始（不计表头）。"
    },
    {
      "rule_id": "R02",
      "source_text": "- R02 规范化与缺失：先去掉每个字段首尾空白。空字符串就是缺失；字符串 NA、null 不作为缺失标记。order_id 或 updated_at 缺失时整批失败。customer_id 缺失时填充 UNKNOWN。amount 缺失时填充 0.00。"
    },
    {
      "rule_id": "R03",
      "source_text": "- R03 时间校验：updated_at 必须满足 YYYY-MM-DDTHH:MM:SSZ 或 YYYY-MM-DDTHH:MM:SS±HH:MM，日期和时区偏移必须有效，不接受无时区或小数秒。全部转换到 UTC 后比较。任意记录时间非法时，整批停止并报告记录序号和字段名。"
    },
    {
      "rule_id": "R04",
      "source_text": "- R04 金额校验：非空 amount 只接受非负十进制定点数，形式为一个或多个数字，可带小数点后 1 或 2 位数字；拒绝负数、指数、千位分隔符和非数字。用十进制精确算术处理，禁止用二进制浮点累计。任意非法值导致整批失败，报告记录序号和字段名。先校验全部输入记录，再去重；将来会被去掉的记录也不能跳过校验。"
    },
    {
      "rule_id": "R05",
      "source_text": "- R05 去重：只按规范化后的 order_id 分组，每组保留 UTC 更新时间最大的整条记录；时间相同时保留输入记录序号最大的整条记录。不能按 customer_id 去重，不能合并不同重复记录的字段。"
    },
    {
      "rule_id": "R06",
      "source_text": "- R06 汇总：只对保留下来的记录按 customer_id 分组。order_count 是该客户保留记录的数量，total_amount 是这些记录 amount 的精确十进制和，latest_updated_at 是这些记录的最大 UTC 时间；UNKNOWN 作为一个正常客户组参与汇总。禁止把已丢弃重复记录计入汇总。"
    },
    {
      "rule_id": "R07",
      "source_text": "- R07 明细输出：写 deduplicated.csv，表头与列序为 order_id,customer_id,updated_at,amount。按 order_id 的 Unicode 字符串码点顺序升序，不按数值排序。时间统一写成 YYYY-MM-DDTHH:MM:SSZ；金额固定两位小数。"
    },
    {
      "rule_id": "R08",
      "source_text": "- R08 汇总输出：写 summary.csv，表头与列序为 customer_id,order_count,total_amount,latest_updated_at。按 customer_id 的 Unicode 字符串码点顺序升序。order_count 写整数；total_amount 固定两位小数；时间使用 UTC 的 YYYY-MM-DDTHH:MM:SSZ。"
    },
    {
      "rule_id": "R09",
      "source_text": "- R09 文件与失败：两个输出都是 UTF-8 无 BOM、逗号分隔、LF 换行的 CSV，使用标准 CSV 引号转义。输出位于用户指定目录，不能覆盖输入或任何已存在的输出文件。表头错误、记录字段数不为 4 或任何校验失败时，报告错误且不生成任何结果文件；所有校验通过后才写出结果。原始输入内容始终不变。"
    },
    {
      "rule_id": "R10",
      "source_text": "- R10 空输入：只有正确表头而无数据记录是合法输入，生成两个只有各自表头的输出文件；完全空文件没有表头，必须报错且不生成结果文件。"
    },
    {
      "rule_id": "R11_completion",
      "source_text": "完成检查：去重明细中 order_id 唯一；汇总 order_count 之和等于明细记录数；汇总 total_amount 之和等于明细金额之和；文件格式、排序和输入不变均符合以上规则。"
    },
    {
      "rule_id": "E01_deduplicated",
      "source_text": "order_id,customer_id,updated_at,amount\n001,C1,2026-01-01T00:00:00Z,12.50\n002,UNKNOWN,2026-01-02T00:00:00Z,0.00\n003,C1,2026-01-03T00:00:00Z,2.25"
    },
    {
      "rule_id": "E02_summary",
      "source_text": "customer_id,order_count,total_amount,latest_updated_at\nC1,2,14.75,2026-01-03T00:00:00Z\nUNKNOWN,1,0.00,2026-01-02T00:00:00Z"
    }
  ],
  "review_status": "pending",
  "review_note": "Source quotations migrated exactly; independent semantic review remains pending"
}
